title,content,author,category,published_date,page_url
ACTT celebrates milestone with first graduates and launch of Innovative Woodwork Program,"The African Centre for Technical Training (ACTT) in Ghana celebrated a significant milestone with its inaugural graduation ceremony, which also marked the launch of its modern Woodwork & Joinery program. 


This event gathered key industry stakeholders and development organizations, including the Delegation of German Industry and Commerce in Ghana (AHK Ghana), Ghana Real Estate Developers Association (GREDA), Geberit Global, the Institution of Engineering and Technology Ghana (IET-Ghana), GIZ, University of Ghana Medical Centre (UGMC), and Furnart Ghana.


Under the theme “Empowering Future Craftsmen, Celebrating Achievement and Innovation in Woodwork,” ACTT graduated 16 professional plumbers. 


These graduates not only acquired hands-on technical skills but also emphasised soft skills and industry apprenticeships through the Plumbing Systems Design program. 





They were awarded Certificates of Competence from ACTT and C-Certificates (Local Dual Training with Elements from the German System) from AHK Ghana. 




Two trainees showcased their project on an Aggregate-Based Water Filtration System for Oil and Debris Removal, underscoring themes of water conservation, reuse, and sustainability.


Awards for exemplary leadership were presented to three trainees: Emmanuel Edem King-Gator for Most Disciplined, Ishmael Lamptey for Most Innovative and Entrepreneurial, and Isaac Frimpong Gyamfi, who received the Overall Best Trainee Award sponsored by Bosch Ghana.


Keynote speaker, Samuel D. Amegayibor, Executive Director of GREDA and Sector Skills Body Chairperson for Construction, highlighted the industry’s struggle with a shortage of skilled personnel, often necessitating labour importation from neighbouring countries. 


He urged graduates to master their competencies and leverage information technology for ongoing professional development.




Miss Penelope Brooke Thompson, Founder & President of ACTT, introduced the guests to the new Woodwork & Joinery program funded by Unorthodox Philanthropy. 


She emphasised the program’s potential impact on reducing imports, creating employment opportunities, and alleviating poverty among marginalized groups.


ACTT’s mission is to address the critical technical skills gap across various industries by offering a wide range of high-quality technical and vocational training programs, artisan certification, mentorship initiatives, and job placement opportunities. 


Training sessions begin in July, October, January, and April each year, with flexible weekday or weekend options.









DISCLAIMER: The Views, Comments, Opinions, Contributions and Statements made by Readers and Contributors on this platform do not necessarily represent the views or policy of Multimedia Group Limited.


 Tags:    Africa Centre Technical Training  artisans 


Related to this story



                            Artisans protest alleged sale of land at Kpone barrier                        
 


                            Election 2024: Mahama promises to introduce support programme for artisans                        
 


                            Gideon Boako empowers artisans and apprentices in Tano North constituency                        
 


                            166 artisans in Eastern Region receive working tools from GNPC                        
 


                            Festive season: Some Ghanaian artisans express concern over low patronage of products                        
 


                            389 artisans in Ashanti region benefit from  GNPC and Aseda Foundation training                        
 


                            GNPC partners Aseda Foundation to set up 261 artisans in Western region                        
 


                            Artificial Intelligence to complement skills of artisans – CTVET Director General                        
 


                            Reduce taxes and import duties – Suame spare parts dealers justify high prices                        
 


                            Traders, artisans and local government institutions in Ashanti region sensitised on AfCFTA",David Andoh,National,30 June 2024 10:37pm,https://www.myjoyonline.com/actt-celebrates-milestone-with-first-graduates-and-launch-of-innovative-woodwork-program/
Samsung to release next frontier of Galaxy AI,"On July 10, Samsung Electronics will host Galaxy Unpacked in Paris — where the iconic cultural nexus and trend epicentre becomes the perfect backdrop for the rollout of the latest cutting-edge innovations.


The next frontier of Galaxy AI is coming. Prepare to discover the power of Galaxy AI, now infused into the latest Galaxy Z series and the entire Galaxy ecosystem. Get ready for a world of possibilities as we enter a new phase of mobile AI.


The highly anticipated event will highlight the next phase of Galaxy AI, integrating advanced artificial intelligence capabilities into the latest Galaxy Z series and the entire Galaxy ecosystem.


Samsung invites tech enthusiasts, industry professionals, and media representatives to join us for Galaxy Unpacked in Paris as we embark on this exciting journey into the new frontier of Galaxy AI.


The event will be streamed live on Samsung.com, Samsung Newsroom, and Samsung’s YouTube channel at 1 p.m.




Attendees and viewers alike will have the opportunity to witness first hand how Samsung's cutting-edge technology continues to push the boundaries of mobile innovation.


Stay tuned and make sure to visit samsungmobilepress.com for all upcoming teasers, trailers, and updates ahead of Unpacked 2024.

DISCLAIMER: The Views, Comments, Opinions, Contributions and Statements made by Readers and Contributors on this platform do not necessarily represent the views or policy of Multimedia Group Limited.


 Tags:    Galaxy AI  Samsung Electronic 


Related to this story



                            A glimpse of new era of Galaxy AI                          
 


                            Dr T. M. Roh: Setting a new standard for smartphones in our changing world                        
 


                            Samsung Ghana launches 2021 TV Media Challenge",Samsung,Technology,30 June 2024 10:29pm,https://www.myjoyonline.com/samsung-to-release-next-frontier-of-galaxy-ai/
